日期,指数代码,指数名称,指数英文名称,code,name,成分券英文名称,交易所,交易所英文名称
2026-06-26,000905,中证500,CSI 500,000009,中国宝安,"China Baoan Group Co.,Ltd.",深圳证券交易所,Shenzhen Stock Exchange
2026-06-26,000905,中证500,CSI 500,000021,深科技,"Shenzhen Kaifa Technology Co., Ltd.",深圳证券交易所,Shenzhen Stock Exchange
2026-06-26,000905,中证500,CSI 500,000027,深圳能源,Shenzhen Energy Group Co Ltd,深圳证券交易所,Shenzhen Stock Exchange
2026-06-26,000905,中证500,CSI 500,000032,深桑达A,Shenzhen SED Industry Co Ltd,深圳证券交易所,Shenzhen Stock Exchange
2026-06-26,000905,中证500,CSI 500,000034,神州数码,"Digital China Group Co., Ltd.",深圳证券交易所,Shenzhen Stock Exchange
2026-06-26,000905,中证500,CSI 500,000039,中集集团,China International Marine Containers (Group) Co Ltd,深圳证券交易所,Shenzhen Stock Exchange
2026-06-26,000905,中证500,CSI 500,000050,深天马A,Tianma Microelectronics Co Ltd,深圳证券交易所,Shenzhen Stock Exchange
2026-06-26,000905,中证500,CSI 500,000060,中金岭南,Shenzhen Zhongjin Lingnan Nonfemet Co Ltd,深圳证券交易所,Shenzhen Stock Exchange
2026-06-26,000905,中证500,CSI 500,000062,深圳华强,Shenzhen Huaqiang Industry Co Ltd,深圳证券交易所,Shenzhen Stock Exchange
2026-06-26,000905,中证500,CSI 500,000088,盐田港,Shenzhen Yan Tian Port Holdings Co Ltd,深圳证券交易所,Shenzhen Stock Exchange
2026-06-26,000905,中证500,CSI 500,000155,川能动力,SICHUAN NEW ENERGY POWER COMPANY LIMITED,深圳证券交易所,Shenzhen Stock Exchange
2026-06-26,000905,中证500,CSI 500,000400,许继电气,XJ Electric Co Ltd,深圳证券交易所,Shenzhen Stock Exchange
2026-06-26,000905,中证500,CSI 500,000415,渤海租赁,"Bohai Leasing Co.,Ltd.",深圳证券交易所,Shenzhen Stock Exchange
2026-06-26,000905,中证500,CSI 500,000423,东阿阿胶,Shandong Dong-Ee Jiao Co Ltd,深圳证券交易所,Shenzhen Stock Exchange
2026-06-26,000905,中证500,CSI 500,000429,粤高速A,Guangdong Provincial Expressway Development Co Ltd,深圳证券交易所,Shenzhen Stock Exchange
2026-06-26,000905,中证500,CSI 500,000513,丽珠集团,Livzon Pharmaceutical Group Inc,深圳证券交易所,Shenzhen Stock Exchange
2026-06-26,000905,中证500,CSI 500,000519,中兵红箭,"NORTH INDUSTRIES GROUP RED ARROW CO.,LTD",深圳证券交易所,Shenzhen Stock Exchange
2026-06-26,000905,中证500,CSI 500,000528,柳工,Guangxi Liugong Machinery Co Ltd,深圳证券交易所,Shenzhen Stock Exchange
2026-06-26,000905,中证500,CSI 500,000537,绿发电力,"Green Development Electricity Group of Tianjin Co., Ltd",深圳证券交易所,Shenzhen Stock Exchange
2026-06-26,000905,中证500,CSI 500,000539,粤电力A,Guangdong Electric Power Development Co Ltd,深圳证券交易所,Shenzhen Stock Exchange
2026-06-26,000905,中证500,CSI 500,000559,万向钱潮,Wanxiang Qianchao Co Ltd,深圳证券交易所,Shenzhen Stock Exchange
2026-06-26,000905,中证500,CSI 500,000582,北部湾港,"Beibuwan Port Co.,Ltd.",深圳证券交易所,Shenzhen Stock Exchange
2026-06-26,000905,中证500,CSI 500,000591,太阳能,"CECEP Solar Energy Co.,Ltd.",深圳证券交易所,Shenzhen Stock Exchange
2026-06-26,000905,中证500,CSI 500,000598,兴蓉环境,"Chengdu Xingrong Environment Co., Ltd.",深圳证券交易所,Shenzhen Stock Exchange
2026-06-26,000905,中证500,CSI 500,000623,吉林敖东,"Jilin Aodong Pharmaceutical Group Co., Ltd.",深圳证券交易所,Shenzhen Stock Exchange
2026-06-26,000905,中证500,CSI 500,000629,钒钛股份,"Pangang Group Vanadium Titanium & Resources Co., Ltd.",深圳证券交易所,Shenzhen Stock Exchange
2026-06-26,000905,中证500,CSI 500,000661,长春高新,Chang Chun High and New Technology Industry (Group) Inc.,深圳证券交易所,Shenzhen Stock Exchange
2026-06-26,000905,中证500,CSI 500,000683,博源化工,Inner Mongolia Berun Chemical Company Limited,深圳证券交易所,Shenzhen Stock Exchange
2026-06-26,000905,中证500,CSI 500,000703,恒逸石化,Hengyi Petrochemical Co Ltd,深圳证券交易所,Shenzhen Stock Exchange
2026-06-26,000905,中证500,CSI 500,000709,河钢股份,HESTEEL COMPANY LIMITED,深圳证券交易所,Shenzhen Stock Exchange
2026-06-26,000905,中证500,CSI 500,000723,美锦能源,"Shanxi Meijin Energy Co.,Ltd.",深圳证券交易所,Shenzhen Stock Exchange
2026-06-26,000905,中证500,CSI 500,000728,国元证券,Guoyuan Securities Company Limited,深圳证券交易所,Shenzhen Stock Exchange
2026-06-26,000905,中证500,CSI 500,000729,燕京啤酒,Beijing Yanjing Brewery Co Ltd,深圳证券交易所,Shenzhen Stock Exchange
2026-06-26,000905,中证500,CSI 500,000733,振华科技,China Zhenhua (Group) Science & Technology Co Ltd,深圳证券交易所,Shenzhen Stock Exchange
2026-06-26,000905,中证500,CSI 500,000737,北方铜业,"NORTH COPPER (SHANXI) CO., LTD.",深圳证券交易所,Shenzhen Stock Exchange
2026-06-26,000905,中证500,CSI 500,000738,航发控制,"AECC AERO-ENGINE CONTROL CO.,LTD.",深圳证券交易所,Shenzhen Stock Exchange
2026-06-26,000905,中证500,CSI 500,000739,普洛药业,"Apeloa Pharmaceutical Co., Ltd.",深圳证券交易所,Shenzhen Stock Exchange
2026-06-26,000905,中证500,CSI 500,000750,国海证券,"Sealand Securities Co., Ltd.",深圳证券交易所,Shenzhen Stock Exchange
2026-06-26,000905,中证500,CSI 500,000783,长江证券,Changjiang Securities Company Limited,深圳证券交易所,Shenzhen Stock Exchange
2026-06-26,000905,中证500,CSI 500,000785,居然智家,"EASYHOME NEW RETAIL GROUP CO., LTD",深圳证券交易所,Shenzhen Stock Exchange
2026-06-26,000905,中证500,CSI 500,000786,北新建材,Beijing New Building Materials Public Ltd Co,深圳证券交易所,Shenzhen Stock Exchange
2026-06-26,000905,中证500,CSI 500,000800,一汽解放,"FAW Jiefang Group Co., Ltd",深圳证券交易所,Shenzhen Stock Exchange
2026-06-26,000905,中证500,CSI 500,000825,太钢不锈,Shanxi Taigang Stainless Steel Co Ltd,深圳证券交易所,Shenzhen Stock Exchange
2026-06-26,000905,中证500,CSI 500,000830,鲁西化工,"Luxi Chemical Group Co.,Ltd.",深圳证券交易所,Shenzhen Stock Exchange
2026-06-26,000905,中证500,CSI 500,000831,中国稀土,"CHINA RARE EARTH RESOURCES AND TECHNOLOGY CO., LTD.",深圳证券交易所,Shenzhen Stock Exchange
2026-06-26,000905,中证500,CSI 500,000878,云南铜业,Yunnan Copper Co Ltd,深圳证券交易所,Shenzhen Stock Exchange
2026-06-26,000905,中证500,CSI 500,000883,湖北能源,Hubei Energy Group Co Ltd,深圳证券交易所,Shenzhen Stock Exchange
2026-06-26,000905,中证500,CSI 500,000887,中鼎股份,"Anhui Zhongding Sealing Parts Co.,Ltd.",深圳证券交易所,Shenzhen Stock Exchange
2026-06-26,000905,中证500,CSI 500,000893,亚钾国际,"Asia-Potash International Investment (Guangzhou) Co., Ltd.",深圳证券交易所,Shenzhen Stock Exchange
2026-06-26,000905,中证500,CSI 500,000898,鞍钢股份,Angang Steel Co Ltd,深圳证券交易所,Shenzhen Stock Exchange
2026-06-26,000905,中证500,CSI 500,000921,海信家电,"HISENSE HOME APPLIANCES GROUP CO.,LTD.",深圳证券交易所,Shenzhen Stock Exchange
2026-06-26,000905,中证500,CSI 500,000932,华菱钢铁,Hunan Valin Steel Co Ltd,深圳证券交易所,Shenzhen Stock Exchange
2026-06-26,000905,中证500,CSI 500,000937,冀中能源,Jizhong Energy Resources Co Ltd,深圳证券交易所,Shenzhen Stock Exchange
2026-06-26,000905,中证500,CSI 500,000951,中国重汽,CNHTC Jinan Truck Co Ltd,深圳证券交易所,Shenzhen Stock Exchange
2026-06-26,000905,中证500,CSI 500,000959,首钢股份,Beijing Shougang Co Ltd,深圳证券交易所,Shenzhen Stock Exchange
2026-06-26,000905,中证500,CSI 500,000960,锡业股份,Yunnan Tin Co Ltd,深圳证券交易所,Shenzhen Stock Exchange
2026-06-26,000905,中证500,CSI 500,000967,盈峰环境,Infore Environment Technology Group Co. Ltd.,深圳证券交易所,Shenzhen Stock Exchange
2026-06-26,000905,中证500,CSI 500,000983,山西焦煤,"Shanxi Coking Coal Energy Group Co.,Ltd.",深圳证券交易所,Shenzhen Stock Exchange
2026-06-26,000905,中证500,CSI 500,000987,越秀资本,"GUANGZHOU YUEXIU CAPITAL HOLDINGS GROUP CO., LTD.",深圳证券交易所,Shenzhen Stock Exchange
2026-06-26,000905,中证500,CSI 500,000997,新 大 陆,"Newland Digital Technology Co.,Ltd.",深圳证券交易所,Shenzhen Stock Exchange
2026-06-26,000905,中证500,CSI 500,001203,大中矿业,"Dazhong Mining Co., Ltd.",深圳证券交易所,Shenzhen Stock Exchange
2026-06-26,000905,中证500,CSI 500,001221,悍高集团,"Higold Group Co.,LTD.",深圳证券交易所,Shenzhen Stock Exchange
2026-06-26,000905,中证500,CSI 500,001286,陕西能源,"SHAANXI ENERGY INVESTMENT CO., LTD.",深圳证券交易所,Shenzhen Stock Exchange
2026-06-26,000905,中证500,CSI 500,001309,德明利,"Shenzhen Techwinsemi Technology Co., Ltd.",深圳证券交易所,Shenzhen Stock Exchange
2026-06-26,000905,中证500,CSI 500,001386,马可波罗,"MarcoPolo Holdings Co.,Ltd.",深圳证券交易所,Shenzhen Stock Exchange
2026-06-26,000905,中证500,CSI 500,001389,广合科技,Delton Technology (Guangzhou) Inc.,深圳证券交易所,Shenzhen Stock Exchange
2026-06-26,000905,中证500,CSI 500,001696,宗申动力,Chongqing Zongshen Power Machinery Co Ltd,深圳证券交易所,Shenzhen Stock Exchange
2026-06-26,000905,中证500,CSI 500,002007,华兰生物,Hualan Biological Engineering INC,深圳证券交易所,Shenzhen Stock Exchange
2026-06-26,000905,中证500,CSI 500,002008,大族激光,"Han's Laser Technology Industry Group Co., Ltd.",深圳证券交易所,Shenzhen Stock Exchange
2026-06-26,000905,中证500,CSI 500,002025,航天电器,Guizhou Space Appliance Co Ltd,深圳证券交易所,Shenzhen Stock Exchange
2026-06-26,000905,中证500,CSI 500,002032,苏泊尔,"Zhejiang Supor Co.,Ltd",深圳证券交易所,Shenzhen Stock Exchange
2026-06-26,000905,中证500,CSI 500,002044,美年健康,"Meinian Onehealth Healthcare Holdings Co., Ltd.",深圳证券交易所,Shenzhen Stock Exchange
2026-06-26,000905,中证500,CSI 500,002056,横店东磁,Hengdian Group DMEGC Magnetics Co Ltd,深圳证券交易所,Shenzhen Stock Exchange
2026-06-26,000905,中证500,CSI 500,002064,华峰化学,"Huafon Chemical Co., Ltd.",深圳证券交易所,Shenzhen Stock Exchange
2026-06-26,000905,中证500,CSI 500,002065,东华软件,"DHC Software Co.,Ltd.",深圳证券交易所,Shenzhen Stock Exchange
2026-06-26,000905,中证500,CSI 500,002078,太阳纸业,Shan Dong Sun Paper Industry Joint Stock Co Ltd,深圳证券交易所,Shenzhen Stock Exchange
2026-06-26,000905,中证500,CSI 500,002085,万丰奥威,"Zhejiang Wanfeng Auto Wheel Co.,Ltd.",深圳证券交易所,Shenzhen Stock Exchange
2026-06-26,000905,中证500,CSI 500,002120,韵达股份,"YUNDA Holding Group CO., Ltd.",深圳证券交易所,Shenzhen Stock Exchange
2026-06-26,000905,中证500,CSI 500,002126,银轮股份,Zhejiang Yinlun Machinery Co Ltd,深圳证券交易所,Shenzhen Stock Exchange
2026-06-26,000905,中证500,CSI 500,002130,沃尔核材,Shenzhen Woer Heat-Shrinkable Material Co Ltd,深圳证券交易所,Shenzhen Stock Exchange
2026-06-26,000905,中证500,CSI 500,002131,利欧股份,"LEO GROUP CO., LTD.",深圳证券交易所,Shenzhen Stock Exchange
2026-06-26,000905,中证500,CSI 500,002138,顺络电子,Shenzhen Sunlord Electronics Co Ltd,深圳证券交易所,Shenzhen Stock Exchange
2026-06-26,000905,中证500,CSI 500,002152,广电运通,GRG Banking Equipment Co Ltd,深圳证券交易所,Shenzhen Stock Exchange
2026-06-26,000905,中证500,CSI 500,002153,石基信息,Beijing Shiji Information Technology Co Ltd,深圳证券交易所,Shenzhen Stock Exchange
2026-06-26,000905,中证500,CSI 500,002155,湖南黄金,Hunan Gold Corporation Limited,深圳证券交易所,Shenzhen Stock Exchange
2026-06-26,000905,中证500,CSI 500,002157,正邦科技,Jiangxi Zhengbang Technology Co Ltd,深圳证券交易所,Shenzhen Stock Exchange
2026-06-26,000905,中证500,CSI 500,002185,华天科技,Tianshui Huatian Technology Co Ltd,深圳证券交易所,Shenzhen Stock Exchange
2026-06-26,000905,中证500,CSI 500,002195,岩山科技,"Shanghai Stonehill Technology Co., Ltd.",深圳证券交易所,Shenzhen Stock Exchange
2026-06-26,000905,中证500,CSI 500,002203,海亮股份,Zhejiang Hailiang Co Ltd,深圳证券交易所,Shenzhen Stock Exchange
2026-06-26,000905,中证500,CSI 500,002223,鱼跃医疗,Jiangsu Yuyue Medical Equipment & Supply Co Ltd,深圳证券交易所,Shenzhen Stock Exchange
2026-06-26,000905,中证500,CSI 500,002244,滨江集团,Hangzhou Binjiang Real Estate Group Co Ltd,深圳证券交易所,Shenzhen Stock Exchange
2026-06-26,000905,中证500,CSI 500,002252,上海莱士,Shanghai RAAS Blood Products Co Ltd,深圳证券交易所,Shenzhen Stock Exchange
2026-06-26,000905,中证500,CSI 500,002261,拓维信息,"Talkweb Information System Co.,Ltd.",深圳证券交易所,Shenzhen Stock Exchange
2026-06-26,000905,中证500,CSI 500,002262,恩华药业,Jiangsu Nhwa Pharmaceutical Co Ltd,深圳证券交易所,Shenzhen Stock Exchange
2026-06-26,000905,中证500,CSI 500,002265,建设工业,"Jianshe Industry Group (Yunnan) Co., Ltd.",深圳证券交易所,Shenzhen Stock Exchange
2026-06-26,000905,中证500,CSI 500,002266,浙富控股,"ZHEFU HOLDING GROUP CO., LTD",深圳证券交易所,Shenzhen Stock Exchange
2026-06-26,000905,中证500,CSI 500,002271,东方雨虹,Beijing Oriental Yuhong Waterproof Technology Co Ltd,深圳证券交易所,Shenzhen Stock Exchange
2026-06-26,000905,中证500,CSI 500,002273,水晶光电,"Zhejiang Crystal-Optech Co., Ltd",深圳证券交易所,Shenzhen Stock Exchange
2026-06-26,000905,中证500,CSI 500,002281,光迅科技,Accelink Technologies Co Ltd,深圳证券交易所,Shenzhen Stock Exchange
2026-06-26,000905,中证500,CSI 500,002299,圣农发展,Fujian Sunner Development Co Ltd,深圳证券交易所,Shenzhen Stock Exchange
2026-06-26,000905,中证500,CSI 500,002312,川发龙蟒,"Sichuan Development Lomon Co.,Ltd.",深圳证券交易所,Shenzhen Stock Exchange
2026-06-26,000905,中证500,CSI 500,002318,久立特材,Zhejiang Jiuli Hi-tech Metals Co Ltd,深圳证券交易所,Shenzhen Stock Exchange
2026-06-26,000905,中证500,CSI 500,002335,科华数据,"KEHUA DATA CO., LTD.",深圳证券交易所,Shenzhen Stock Exchange
2026-06-26,000905,中证500,CSI 500,002340,格林美,Shenzhen Green Eco-manufacture Hi-tech Co Ltd,深圳证券交易所,Shenzhen Stock Exchange
2026-06-26,000905,中证500,CSI 500,002402,和而泰,Shenzhen H&T Intelligent Control Co Ltd,深圳证券交易所,Shenzhen Stock Exchange
2026-06-26,000905,中证500,CSI 500,002407,多氟多,Do-Fluoride Chemicals Co Ltd,深圳证券交易所,Shenzhen Stock Exchange
2026-06-26,000905,中证500,CSI 500,002409,雅克科技,Jiangsu Yoke Technology Co Ltd,深圳证券交易所,Shenzhen Stock Exchange
2026-06-26,000905,中证500,CSI 500,002410,广联达,Glodon Software Co Ltd,深圳证券交易所,Shenzhen Stock Exchange
2026-06-26,000905,中证500,CSI 500,002414,高德红外,Wuhan Guide Infrared Co Ltd,深圳证券交易所,Shenzhen Stock Exchange
2026-06-26,000905,中证500,CSI 500,002423,中粮资本,"COFCO CAPITAL HOLDINGS CO.,LTD.",深圳证券交易所,Shenzhen Stock Exchange
2026-06-26,000905,中证500,CSI 500,002429,兆驰股份,Shenzhen MTC Co Ltd,深圳证券交易所,Shenzhen Stock Exchange
2026-06-26,000905,中证500,CSI 500,002430,杭氧股份,"HANGZHOU OXYGEN PLANT GROUP CO., LTD.",深圳证券交易所,Shenzhen Stock Exchange
2026-06-26,000905,中证500,CSI 500,002432,九安医疗,Andon Health Co Ltd,深圳证券交易所,Shenzhen Stock Exchange
2026-06-26,000905,中证500,CSI 500,002436,兴森科技,Shenzhen Fastprint Circuit Tech Co Ltd,深圳证券交易所,Shenzhen Stock Exchange
2026-06-26,000905,中证500,CSI 500,002444,巨星科技,Hangzhou Great Star Industrial Co Ltd,深圳证券交易所,Shenzhen Stock Exchange
2026-06-26,000905,中证500,CSI 500,002461,珠江啤酒,Guangzhou Zhujiang Brewery Co Ltd,深圳证券交易所,Shenzhen Stock Exchange
2026-06-26,000905,中证500,CSI 500,002465,海格通信,Guangzhou Haige Communications Group Incorporated Company,深圳证券交易所,Shenzhen Stock Exchange
2026-06-26,000905,中证500,CSI 500,002472,双环传动,Zhejiang Shuanghuan Driveline Co Ltd,深圳证券交易所,Shenzhen Stock Exchange
2026-06-26,000905,中证500,CSI 500,002487,大金重工,Dajin Heavy Industry Co Ltd,深圳证券交易所,Shenzhen Stock Exchange
2026-06-26,000905,中证500,CSI 500,002500,山西证券,Shanxi Securities Co Ltd,深圳证券交易所,Shenzhen Stock Exchange
2026-06-26,000905,中证500,CSI 500,002508,老板电器,Hangzhou Robam Appliances Co Ltd,深圳证券交易所,Shenzhen Stock Exchange
2026-06-26,000905,中证500,CSI 500,002517,恺英网络,Taiya Shoes Co Ltd,深圳证券交易所,Shenzhen Stock Exchange
2026-06-26,000905,中证500,CSI 500,002568,百润股份,"SHANGHAI BAIRUN INVESTMENT HOLDING GROUP CO.,LTD.",深圳证券交易所,Shenzhen Stock Exchange
2026-06-26,000905,中证500,CSI 500,002583,海能达,Hytera Communications Co Ltd,深圳证券交易所,Shenzhen Stock Exchange
2026-06-26,000905,中证500,CSI 500,002601,龙佰集团,"LB Group Co., Ltd.",深圳证券交易所,Shenzhen Stock Exchange
2026-06-26,000905,中证500,CSI 500,002603,以岭药业,Shijiazhuang Yiling Pharmaceutical Co Ltd,深圳证券交易所,Shenzhen Stock Exchange
2026-06-26,000905,中证500,CSI 500,002608,江苏国信,Sainty Marine Corporation Ltd,深圳证券交易所,Shenzhen Stock Exchange
2026-06-26,000905,中证500,CSI 500,002624,完美世界,"Perfect World Co., Ltd.",深圳证券交易所,Shenzhen Stock Exchange
2026-06-26,000905,中证500,CSI 500,002670,国盛证券,GUOSHENG SECURITIES Inc.,深圳证券交易所,Shenzhen Stock Exchange
2026-06-26,000905,中证500,CSI 500,002673,西部证券,"WESTERN SECURITIES CO., LTD",深圳证券交易所,Shenzhen Stock Exchange
2026-06-26,000905,中证500,CSI 500,002683,广东宏大,"Guangdong Hongda Holdings Group Co., Ltd.",深圳证券交易所,Shenzhen Stock Exchange
2026-06-26,000905,中证500,CSI 500,002738,中矿资源,"Sinomine Resource Group Co., Ltd.",深圳证券交易所,Shenzhen Stock Exchange
2026-06-26,000905,中证500,CSI 500,002739,儒意电影,Ruyi Film Entertainment Company Limited,深圳证券交易所,Shenzhen Stock Exchange
2026-06-26,000905,中证500,CSI 500,002756,永兴材料,"Yongxing Special Materials Technology Co.,Ltd.",深圳证券交易所,Shenzhen Stock Exchange
2026-06-26,000905,中证500,CSI 500,002773,康弘药业,"Chengdu Kanghong Pharmaceutical Group Co., Ltd",深圳证券交易所,Shenzhen Stock Exchange
2026-06-26,000905,中证500,CSI 500,002797,第一创业,"First Capital Securities Co., Ltd.",深圳证券交易所,Shenzhen Stock Exchange
2026-06-26,000905,中证500,CSI 500,002812,恩捷股份,"Yunnan Energy New Material (Group) Co., Ltd.",深圳证券交易所,Shenzhen Stock Exchange
2026-06-26,000905,中证500,CSI 500,002821,凯莱英,"Asymchem Laboratories (Tianjin) Co., Ltd.",深圳证券交易所,Shenzhen Stock Exchange
2026-06-26,000905,中证500,CSI 500,002831,裕同科技,"ShenZhen YUTO Packaging Technology Co., Ltd.",深圳证券交易所,Shenzhen Stock Exchange
2026-06-26,000905,中证500,CSI 500,002841,视源股份,Guangzhou Shiyuan Electronic Technology Company Limited,深圳证券交易所,Shenzhen Stock Exchange
2026-06-26,000905,中证500,CSI 500,002850,科达利,"Shenzhen Kedali Industry Co., Ltd.",深圳证券交易所,Shenzhen Stock Exchange
2026-06-26,000905,中证500,CSI 500,002851,麦格米特,"Shenzhen Megmeet Electrical Co., Ltd.",深圳证券交易所,Shenzhen Stock Exchange
2026-06-26,000905,中证500,CSI 500,002926,华西证券,"Huaxi Securities Co., Ltd.",深圳证券交易所,Shenzhen Stock Exchange
2026-06-26,000905,中证500,CSI 500,002939,长城证券,"CHINA GREAT WALL SECURITIES CO., LTD.",深圳证券交易所,Shenzhen Stock Exchange
2026-06-26,000905,中证500,CSI 500,002945,华林证券,"ChinaLin Securities Co., Ltd.",深圳证券交易所,Shenzhen Stock Exchange
2026-06-26,000905,中证500,CSI 500,002966,苏州银行,"BANK OF SUZHOU CO., LTD.",深圳证券交易所,Shenzhen Stock Exchange
2026-06-26,000905,中证500,CSI 500,002984,森麒麟,"QINGDAO SENTURY TIRE CO., LTD.",深圳证券交易所,Shenzhen Stock Exchange
2026-06-26,000905,中证500,CSI 500,003021,兆威机电,"SHENZHEN ZHAOWEI MACHINERY&ELECTRONIC CO.,LTD",深圳证券交易所,Shenzhen Stock Exchange
2026-06-26,000905,中证500,CSI 500,003022,联泓新科,Levima Advanced Materials Corporation,深圳证券交易所,Shenzhen Stock Exchange
2026-06-26,000905,中证500,CSI 500,003031,中瓷电子,"HEBEI SINOPACK ELECTRONIC TECHNOLOGY CO.,LTD.",深圳证券交易所,Shenzhen Stock Exchange
2026-06-26,000905,中证500,CSI 500,003035,南网能源,"China Southern Power Grid Energy Efficiency&Clean Energy Co.,Ltd.",深圳证券交易所,Shenzhen Stock Exchange
2026-06-26,000905,中证500,CSI 500,300001,特锐德,Qingdao TGOOD Electric Co Ltd,深圳证券交易所,Shenzhen Stock Exchange
2026-06-26,000905,中证500,CSI 500,300002,神州泰岳,Beijing Ultrapower Software Co Ltd,深圳证券交易所,Shenzhen Stock Exchange
2026-06-26,000905,中证500,CSI 500,300003,乐普医疗,Lepu Medical Technology (Beijing) Co Ltd,深圳证券交易所,Shenzhen Stock Exchange
2026-06-26,000905,中证500,CSI 500,300012,华测检测,"CENTRE TESTING INTERNATIONAL GROUP CO., LTD.",深圳证券交易所,Shenzhen Stock Exchange
2026-06-26,000905,中证500,CSI 500,300017,网宿科技,"Wangsu Science and Technology Co.,Ltd.",深圳证券交易所,Shenzhen Stock Exchange
2026-06-26,000905,中证500,CSI 500,300024,机器人,Siasun Robot & Automation Co Ltd,深圳证券交易所,Shenzhen Stock Exchange
2026-06-26,000905,中证500,CSI 500,300037,新宙邦,Shenzhen Capchem Technology Co Ltd,深圳证券交易所,Shenzhen Stock Exchange
2026-06-26,000905,中证500,CSI 500,300054,鼎龙股份,"Hubei Dinglong CO.,Ltd.",深圳证券交易所,Shenzhen Stock Exchange
2026-06-26,000905,中证500,CSI 500,300058,蓝色光标,"Bluefocus Data Technology Co., Ltd.",深圳证券交易所,Shenzhen Stock Exchange
2026-06-26,000905,中证500,CSI 500,300073,当升科技,Beijing Easpring Material Technology Co Ltd,深圳证券交易所,Shenzhen Stock Exchange
2026-06-26,000905,中证500,CSI 500,300100,双林股份,"Shuanglin Co.,Ltd.",深圳证券交易所,Shenzhen Stock Exchange
2026-06-26,000905,中证500,CSI 500,300115,长盈精密,Shenzhen Evenwin Precision Technology Co Ltd,深圳证券交易所,Shenzhen Stock Exchange
2026-06-26,000905,中证500,CSI 500,300136,信维通信,Shenzhen Sunway Communication Co Ltd,深圳证券交易所,Shenzhen Stock Exchange
2026-06-26,000905,中证500,CSI 500,300140,节能环境,"CECEP ENVIRONMENTAL PROTECTION CO.,LTD.",深圳证券交易所,Shenzhen Stock Exchange
2026-06-26,000905,中证500,CSI 500,300142,沃森生物,Walvax Biotechnology Co Ltd,深圳证券交易所,Shenzhen Stock Exchange
2026-06-26,000905,中证500,CSI 500,300144,宋城演艺,"SONGCHENG PERFORMANCE DEVELOPMENT CO., LTD.",深圳证券交易所,Shenzhen Stock Exchange
2026-06-26,000905,中证500,CSI 500,300146,汤臣倍健,"BY-HEALTH CO., LTD",深圳证券交易所,Shenzhen Stock Exchange
2026-06-26,000905,中证500,CSI 500,300207,欣旺达,Sunwoda Electronic Co Ltd,深圳证券交易所,Shenzhen Stock Exchange
2026-06-26,000905,中证500,CSI 500,300223,北京君正,Ingenic Semiconductor Co Ltd,深圳证券交易所,Shenzhen Stock Exchange
2026-06-26,000905,中证500,CSI 500,300285,国瓷材料,"Shandong Sinocera Functional Material Co., Ltd",深圳证券交易所,Shenzhen Stock Exchange
2026-06-26,000905,中证500,CSI 500,300339,润和软件,"Jiangsu Hoperun Software Co., Ltd.",深圳证券交易所,Shenzhen Stock Exchange
2026-06-26,000905,中证500,CSI 500,300346,南大光电,"Jiangsu Nata Opto-electronic Material Co.,Ltd",深圳证券交易所,Shenzhen Stock Exchange
2026-06-26,000905,中证500,CSI 500,300373,扬杰科技,"Yangzhou Yangjie Electronic Technology Co.,Ltd",深圳证券交易所,Shenzhen Stock Exchange
2026-06-26,000905,中证500,CSI 500,300383,光环新网,"Beijing Sinnet Technology Co., Ltd.",深圳证券交易所,Shenzhen Stock Exchange
2026-06-26,000905,中证500,CSI 500,300390,天华新能,"Canmax Technologies Co., Ltd.",深圳证券交易所,Shenzhen Stock Exchange
2026-06-26,000905,中证500,CSI 500,300395,菲利华,HUBEI FEILIHUA QUARTZ GLASS CO.LTD,深圳证券交易所,Shenzhen Stock Exchange
2026-06-26,000905,中证500,CSI 500,300432,富临精工,"Mianyang Fulin Precision Co.,Ltd.",深圳证券交易所,Shenzhen Stock Exchange
2026-06-26,000905,中证500,CSI 500,300454,深信服,Sangfor Technologies Inc.,深圳证券交易所,Shenzhen Stock Exchange
2026-06-26,000905,中证500,CSI 500,300458,全志科技,"All Winner Technology Co., Ltd.",深圳证券交易所,Shenzhen Stock Exchange
2026-06-26,000905,中证500,CSI 500,300474,景嘉微,"Changsha Jingjia Microelectronics Co., Ltd.",深圳证券交易所,Shenzhen Stock Exchange
2026-06-26,000905,中证500,CSI 500,300475,香农芯创,"Shannon Semiconductor Technology Co., Ltd.",深圳证券交易所,Shenzhen Stock Exchange
2026-06-26,000905,中证500,CSI 500,300487,蓝晓科技,"SUNRESIN NEW MATERIALS CO.,LTD, XI' AN",深圳证券交易所,Shenzhen Stock Exchange
2026-06-26,000905,中证500,CSI 500,300496,中科创达,"Thunder Software Technology Co., Ltd.",深圳证券交易所,Shenzhen Stock Exchange
2026-06-26,000905,中证500,CSI 500,300548,长芯博创,"EverProX Technologies Co., Ltd.",深圳证券交易所,Shenzhen Stock Exchange
2026-06-26,000905,中证500,CSI 500,300558,贝达药业,"Betta Pharmaceuticals Co.,Ltd",深圳证券交易所,Shenzhen Stock Exchange
2026-06-26,000905,中证500,CSI 500,300567,精测电子,"Wuhan Jingce Electronic Technology Co., Ltd.",深圳证券交易所,Shenzhen Stock Exchange
